{
  "$schema": "https://json-schema.org/draft/2020-12/schema",
  "$id": "https://github.com/attractor-set/ASET/raw/main/seed/canonical/schemas/invariant-coverage.schema.json",
  "type": "object",
  "additionalProperties": false,
  "required": [
    "document_type",
    "schema_version",
    "normative",
    "coverage_policy",
    "requirements",
    "invariants",
    "transitions",
    "mutation_catalog",
    "claim_boundary"
  ],
  "properties": {
    "document_type": {"const": "aset-seed-invariant-coverage"},
    "schema_version": {"const": 1},
    "normative": {"const": true},
    "coverage_policy": {
      "type": "object",
      "additionalProperties": false,
      "required": [
        "requirements_complete",
        "invariants_complete",
        "transitions_complete",
        "formal_property_required",
        "conformance_case_required",
        "semantic_mutation_required",
        "orphan_evidence_forbidden"
      ],
      "properties": {
        "requirements_complete": {"const": true},
        "invariants_complete": {"const": true},
        "transitions_complete": {"const": true},
        "formal_property_required": {"const": true},
        "conformance_case_required": {"const": true},
        "semantic_mutation_required": {"const": true},
        "orphan_evidence_forbidden": {"const": true}
      }
    },
    "requirements": {
      "type": "array",
      "minItems": 12,
      "items": {"$ref": "#/$defs/coverageEntry"}
    },
    "invariants": {
      "type": "array",
      "minItems": 12,
      "items": {"$ref": "#/$defs/coverageEntry"}
    },
    "transitions": {
      "type": "array",
      "minItems": 3,
      "items": {
        "type": "object",
        "additionalProperties": false,
        "required": ["id", "positive_cases", "negative_cases"],
        "properties": {
          "id": {"pattern": "^SEED-TX-[0-9]{3}$", "type": "string"},
          "positive_cases": {"$ref": "#/$defs/nonEmptyStrings"},
          "negative_cases": {"$ref": "#/$defs/nonEmptyStrings"}
        }
      }
    },
    "mutation_catalog": {
      "type": "array",
      "minItems": 13,
      "items": {
        "type": "object",
        "additionalProperties": false,
        "required": ["id", "operator", "description", "case_ids", "seed_invariants", "seed_requirements"],
        "properties": {
          "id": {"pattern": "^SEED-MUT-[0-9]{3}$", "type": "string"},
          "operator": {"type": "string", "minLength": 1},
          "description": {"type": "string", "minLength": 1},
          "case_ids": {"type": "array", "items": {"type": "string"}},
          "seed_invariants": {"type": "array", "items": {"pattern": "^SEED-INV-[0-9]{3}$", "type": "string"}},
          "seed_requirements": {"type": "array", "items": {"pattern": "^ASET-SEED-REQ-[0-9]{3}$", "type": "string"}}
        }
      }
    },
    "claim_boundary": {
      "type": "object",
      "additionalProperties": false,
      "required": ["covered", "not_claimed"],
      "properties": {
        "covered": {"$ref": "#/$defs/nonEmptyStrings"},
        "not_claimed": {"$ref": "#/$defs/nonEmptyStrings"}
      }
    }
  },
  "$defs": {
    "nonEmptyStrings": {
      "type": "array",
      "minItems": 1,
      "items": {"type": "string", "minLength": 1}
    },
    "coverageEntry": {
      "type": "object",
      "additionalProperties": false,
      "required": ["id", "formal_properties", "conformance_cases", "semantic_mutations"],
      "properties": {
        "id": {"type": "string", "minLength": 1},
        "invariants": {"type": "array", "items": {"pattern": "^SEED-INV-[0-9]{3}$", "type": "string"}},
        "formal_properties": {"$ref": "#/$defs/nonEmptyStrings"},
        "conformance_cases": {"$ref": "#/$defs/nonEmptyStrings"},
        "semantic_mutations": {"$ref": "#/$defs/nonEmptyStrings"}
      }
    }
  }
}
